,text,id,polarities
515,but overall i give it a 10,1573534:7,['positive']
516,10,1573534:8,['positive']
517,Haru on Park S is simply disgusting.,1577714:1,['negative']
518,The fish was not fresh and the rice tasted old and stale.,1577714:2,"['negative', 'negative']"
519,"Quite frankly, this is some of the worst sushi I have ever tried.",1577714:3,['negative']
520,Will never be back.,1577714:4,['negative']
521,honestly the worst sushi my husband and i had in our entire lives.,1586174:0,['negative']
522,not sure why this restaurant would be rated that highly.,1586174:2,['negative']
523,the all-u-can-eat sushi is definitely in very poor quality.,1586174:3,['negative']
524,"limited menu, no-so-fresh ingredients, thinly-sliced fish, fall-apart rice. ",1586174:4,"['negative', 'negative', 'negative', 'negative']"
525,"the only things u could really taste are the very salty soy sauce (even its low sodium), the vinegar-soaked rice, and the scallion on top of the fish. ",1586174:5,"['negative', 'negative']"
526,the waitstaffs are nice though.,1586174:6,['positive']
527,wont come back again for sure!,1586174:7,['negative']
528,I have been to Roth's twice and both times were very disappointing.,1603698:0,['negative']
529,"Both times I was extremely dissappointed by the service, which was boarderline rude.",1603698:2,['negative']
530,They wouldnt even let me finish my glass of wine before offering another.,1603698:3,['negative']
531,Much of the time it seems like they do not care about you.,1603698:4,['negative']
532,"The dinner was ok, nothing I would have again.",1603698:5,['negative']
533,"I had their eggs benedict for brunch, which were the worst in my entire life, I tried removing the hollondaise sauce completely that was how failed it was.",1603698:6,['negative']
534,This was a great surprise.,1606837:0,['positive']
535,With the theater 2 blocks away we had a delicious meal in a beautiful room.,1606837:1,"['positive', 'positive', 'positive']"
536,The service was attentive.,1606837:2,['positive']
537,I look forward to eating here again,1606837:3,['positive']
538,Planet Thai is great!,1609375:0,['positive']
539,"We love the food, drinks, and atmosphere!",1609375:1,"['positive', 'positive', 'positive']"
540,"The svc can be a bit rude at times, esp if you have big group, but overall the restaurant is a must!",1609375:2,"['negative', 'positive']"
541,"Try the Pad Thai, it's fabulous and their prices are so cheap!",1609375:3,"['positive', 'positive']"
542,"Just because it's cheap does NOT mean the portions are small or the food is nasty, IT IS GREAT!",1609375:4,"['positive', 'positive', 'positive']"
543,"They forgot a sandwich, didn't include plastic forks, and didn't include pita with the hummus platter.",1611489:0,['negative']
544,"Also, the sandwiches (nearing $7) didn't come with anything like chips or a side.",1611489:1,"['negative', 'negative']"
545,"Overall, not worth the money.",1611489:2,"['negative', 'negative']"
546,"Eating in, the atmosphere saves it, but at your desk, it's a very disappointing experience.",1611489:3,"['positive', 'negative']"
547,Chennai Garden is my favorite Indian restaurant in the city.,1615322:1,['positive']
548,They have authentic Indian at amazin prices.,1615322:2,"['positive', 'positive']"
549,This restaurant is VEGETARIAN; there are NO MEAT dishes whatsoever.,1615322:3,['negative']
550,The seats are uncomfortable if you are sitting against the wall on wooden benches.,1615322:4,['negative']
551,It's a rather cramped and busy restaurant and it closes early.,1615322:5,"['negative', 'negative']"
552,Patroon features a nice cigar bar and has great staff.,1623276:0,"['positive', 'positive']"
553,The food is tasty and portion sizes are appropriate.,1623276:1,"['positive', 'positive']"
554,This is a nice restaurant if you are looking for a good place to host an intimate dinner meeting with business associates.,1623276:2,['positive']
555,Not a great place for family or general dining.,1623276:3,['negative']
556,LLOOVVE THIS PLACE.,1626564:0,['positive']
557,Food is excellent.,1626564:1,['positive']
558,Fish is so very fresh.,1626564:2,['positive']
559,Waitstaff are very friendly.,1626564:3,['positive']
560,Love YUKA.,1626564:4,['positive']
561,Mermaid Inn is an overall good restaurant with really good seafood.,1632445:0,"['positive', 'positive']"
562,The menu is limited but almost all of the dishes are excellent.,1632445:1,"['negative', 'positive']"
563,The lobster sandwich is good and the spaghetti with Scallops and Shrimp is great.,1632445:2,"['positive', 'positive']"
564,The service is good and ambience is good for a date or group outing.,1632445:3,"['positive', 'positive']"
565,The only fallback on this restaurant is the prices.,1632445:4,['negative']
566,"Even though its good seafood, the prices are too high.",1632445:5,"['positive', 'negative']"
567,The lobster sandwich is $24 and although it was good it was not nearly enough to warrant that price.,1632445:6,"['positive', 'negative', 'negative']"
568,We were very pleasantly surprised.,1632929:2,['positive']
569,"The food was delicious (I had a halibut special, my husband had steak), and the service was top-notch.",1632929:3,"['positive', 'positive', 'positive', 'positive']"
570,"When my dessert came, there was a candle in it - not because anyone asked for one - but because the waiter must have seen me opening my birthday card and gift, and said he knew it was a special occassion of some sort.",1632929:4,['positive']
571,Truly the mark of an attentive waiter.,1632929:5,['positive']
572,I highly recommend the restaurant based on our experience last night.,1632929:6,['positive']
573,We ate at this Thai place following the reviews but very unhappy with the foods.,1642666:0,['negative']
574,We thought that this place is using too much of MSG cooking in the foods.,1642666:1,['negative']
575,"They don't concern much of customer's health, just want to make money.",1642666:3,['negative']
576,please don't fool us.,1642666:4,['negative']
577,"I recommend the jelly fish, drunken chicken and the soupy dumplings, certainly the stir fry blue crab.",1649025:1,"['positive', 'positive', 'positive', 'positive']"
578,The food is so cheap and the waiters are nice.,1649025:2,"['positive', 'positive']"
579,"Of course, it is crowded but who cares.",1649025:3,['neutral']
580,Authentic Shanghai style and I cannot recommend a better Shanghai place in New York.,1649025:4,['positive']
581,Have frequented 'ino for several years and the food remains excellent.,1655504:0,['positive']
582,Cheese plate is a varied delight and great bargain at $10.,1655504:1,"['positive', 'positive', 'positive']"
583,"The large selection of bruschettas, paninis, tramezzinis keep the palate from stagnating.",1655504:2,"['positive', 'positive', 'positive']"
584,"(The asparagus, truffle oil, parmesan bruschetta is a winner!)",1655504:3,['positive']
585,Wine list is extensive without being over-priced.,1655504:4,"['positive', 'positive']"
586,"Be sure to try the seasonal, and always delicious, specials.",1655504:5,['positive']
587,Definitely a neighborhood favorite.,1655504:6,['positive']
588,I loved this place!!,1655521:0,['positive']
589,I almost hesititate to write a review because the atmosphere was so great and I would hate for it too become to crowded.,1655521:1,['positive']
590,"The food was very good, a great deal, and the place its self was great.",1655521:2,"['positive', 'positive', 'positive']"
591,"The wait staff is very freindly, they make it feel like you're eating in a freindly little european town.",1655521:3,['positive']
592,"I like Cafe Noir dont get me wrong, it is jsut that the people who work there are evil and incompetent!!",1660047:0,"['negative', 'positive']"
593,"The service was terrible, we had to wait for everything and ask several of different people for the same thing before we were allowed to be served.",1660047:1,['negative']
594,"The waitress, seems to be more concerned of looking good than actually waitressing.",1660047:2,['negative']
595,"After dinner the manager grabbed my boyfriend, asked him: Where are you from...maybe you dont know how things work in America...and in the end stormed away almost teareyed yelling that tips are the only thing they survive on.",1660047:3,['negative']
596,"We did tip, I guess the model/waitress just wanted more and complained to the manager.",1660047:4,['negative']
597,"The whole set up is truly unprofessional and I wish Cafe Noir would get some good staff, because despite the current one this is a great place.",1660047:5,"['negative', 'positive']"
598,Pizza here is consistently good.,1661043:0,['positive']
599,Salads are a delicious way to begin the meal.,1661043:1,['positive']
600,You should pass on the calamari.,1661043:2,['negative']
601,It is thick and slightly soggy.,1661043:3,['negative']
602,Decor is charming.,1661043:4,['positive']
603,Service is average.,1661043:5,['neutral']
604,What a great place.,1661757:0,['positive']
605,"The ambience was so fun, and the prices were great, on top of the fact that the food was really tasty.",1661757:2,"['positive', 'positive', 'positive']"
606,"I wasn't thrilled to have to wait on line for thirty minutes, but I guess that's the price you pay for a popular place.",1661757:3,['neutral']
607,I would definitely recommend SEA if you like thai cuisine!,1661757:4,['positive']
608,I was here a few weeks back and we had the worst customer service experience at a restaurant ever.,1662726:0,['negative']
609,"A gentleman, maybe the manager, came to our table, and without so much as a smile or greeting asked for our order.",1662726:1,['negative']
610,"When asked about how a certain dish was prepared in comparison to a similar at other thai restaurants, he replied this is not Mcdonald's, every place makes things differently ",1662726:2,['negative']
611,"While it is understandable that every place is indeed different, there was not a need to be uncourteous to customers and downright rude.",1662726:3,['negative']
612,Never again!,1662726:5,['negative']
613,I absolutely Loved this place.,1663111:0,['positive']
614,"Excellent atmosphere, delicious dishes good and friendly service.",1663111:2,"['positive', 'positive', 'positive']"
615,this is can became on e of the NY Italian Food fare institutions.,1663111:3,['positive']
616,I think that it is absolutely brilliant and well runned business operation.,1663111:4,['positive']
617,The wine list is also really nice.,1663111:5,['positive']
618,"Everything was wonderful; food, drinks, staff, mileau.",1664346:1,"['positive', 'positive', 'positive', 'positive', 'positive']"
619,I would highly recommend this place!,1664346:2,['positive']
620,I have been to Casimir over 5 times and I have always had a great time there.,1671113:0,['positive']
621,The food is great and reasonably priced.,1671113:1,"['positive', 'positive']"
622,"I have tried to make reservations, but both times, the hostess didn't have my name.",1671113:2,['negative']
623,"If the weather is nice, try to snag an outside table.",1671113:3,['positive']
624,"The staff has been nice, but they seemed really stressed and the unisex bathroom needs to be cleaned more often.",1671113:4,"['positive', 'negative', 'negative']"
625,My boyfriend and I went there to celebrate my birthday the other night and all I can say is that it was magnificent.,1700205:0,['positive']
626,"From the spectacular caviar to the hospitable waitstaff, I felt like royalty and enjoyed every second of it.",1700205:1,"['positive', 'positive']"
627,"Considering we were the last patrons there and it was after the closing time, the waitstaff did not rush us at all and made us feel comfortable and relaxed.",1700205:2,['positive']
628,I highly recommend Caviar Russe to anyone who wants delicious top grade caviar and fantastic service.,1700205:3,"['positive', 'positive']"
629,Nice Family owned traditional restaurant.,1702257:0,['positive']
630,Fresh ingredients and everything is made to order.,1702257:1,"['positive', 'positive']"
631,I was pleasantly surprised to find this gem in Hoboken.,1702257:2,['positive']
632,Friendly staff that actually lets you enjoy your meal and the company you're with.,1702257:3,['positive']
633,"I found the food to be outstanding, particulary the salmon dish I had.",1706644:1,"['positive', 'positive']"
634,"I also ordered the Change Mojito, which was out of this world.",1706644:2,['positive']
635,"My friends settled for rice dishes, but we came back the following day to try the dim sum, which was good...not outstanding, but good.",1706644:3,['neutral']
636,"We ate out in the back patio, which is worth it as it's cool and the music is hear well there.",1706644:4,"['positive', 'positive']"
637,"Overall, excellent restaurant!",1706644:5,['positive']
638,The food was good.,1707201:1,['positive']
639,The place was nice and calm.,1707201:2,['positive']
640,but the service was a bit slow.,1707201:3,['negative']
641,The buffet had a nice selection.,1707741:1,['positive']
642,The food was average or above including some surprising tasty dishes.,1707741:2,"['positive', 'positive']"
643,Service was also very good.,1707741:3,['positive']
644,I would go back.,1707741:4,['positive']
645,I got an excellent piece of cheesecake and we had several other nice pastries.,1710746:0,"['positive', 'positive']"
646,"I would recommend Roxy's for that, but not for their food.",1710746:1,"['negative', 'positive']"
647,My son and his girlfriend both wanted cheeseburgers and they were huge!,1710746:2,['neutral']
648,"But, they were too big for the bun.",1710746:3,['negative']
649,"Consequently, their burgers fell apart in their hands and made such a mess that they did'nt feel like finishing them.",1710746:4,['negative']
650,Also they were $15 each!,1710746:5,['negative']
651,I had a huge pastrami sandwich on a roll.,1710746:6,['neutral']
652,It was $14 not really bad for a pound of Pastrami-but it didn't have much taste-I've had better for less elsewhere!,1710746:7,"['neutral', 'negative']"
653,"This place is really trendi but they have forgotten about the most important part of a  restaurant, the food.",1713185:0,"['negative', 'positive']"
654,"The last two times I ordered from here my food was soo spicy that  I could barely eat it, and the spice took away from the flavor of the dish.",1713185:1,"['negative', 'negative']"
655,And the Tom Kha soup was pathetic.,1713185:2,['negative']
656,If you want good authentic Thai this place is not the place to go.,1713185:3,['negative']
657,"We went here for lunch a couple of weeks ago on a Saturday, and I was thoroughly impressed with the food.",1718513:0,['positive']
658,"The pesto pizza was excellent, thin-crust pizza with a nice amount of spicy Italian cheese that I'd never heard of before.",1718513:1,"['positive', 'positive']"
659,"Conveniently located too, being right on Bedford ave.",1718513:2,['positive']
660,"THe back garden sitting area is very pleasant, where you can see their personal herb garden.",1718513:3,['positive']
661,I will definetly be going back.,1718513:4,['positive']
662,We had the lobster sandwich and it was FANTASTIC.,1719567:0,['positive']
663,"My husband said he could've eaten several more, the portion was fine for me he even exclaimed that the french fries were the best he has had.",1719567:1,"['negative', 'positive', 'positive']"
664,We had the scallops as an appetizer and they were delicious and the sauce was wonderful.,1719567:2,"['positive', 'positive']"
665,We waited at the bar and had martinis that were just right.,1719567:4,['positive']
666,We will be back.,1719567:5,['positive']
667,love the food.,1723402:0,['positive']
668,it's the only place you can get yummy authentic japanese comfort food.,1723402:1,['positive']
669,and you can't beat the prices.,1723402:3,['positive']
670,highly recommended.,1723402:4,['positive']
671,I've lived in NY for 5 years and this place has it all.,1723658:0,['positive']
672,"Great food, good size menu, great service and an unpretensious setting.",1723658:1,"['positive', 'positive', 'positive', 'positive']"
673,"The dishes offered were unique, very tasty and fresh from the lamb sausages, sardines with biscuits, large whole shrimp to the amazing pistachio ice cream (the best and freshest I've ever had).",1723658:2,"['positive', 'positive', 'positive', 'positive', 'positive']"
674,I'm glad I was introduced to this place and this is a rare gem in NY.,1723658:3,['positive']
675,"The freshest, best variety, and the fastest delivery.",1726001:1,"['positive', 'positive', 'positive']"
676,Also very inexpensive.,1726001:2,['positive']
677,A great choice at any cost and a great deal.,1726001:3,"['positive', 'positive']"
678,The service was excellent and the food was delicious.,1726427:0,"['positive', 'positive']"
679,"We are very particular about sushi and were both please with every choice which included: ceviche mix (special), crab dumplings, assorted sashimi, sushi and rolls, two types of sake, and the banana tempura.",1726427:1,"['positive', 'positive', 'positive', 'positive', 'positive', 'positive', 'positive', 'positive']"
680,Definitely a great spot for a nice occasion or date.,1726427:3,['positive']
681,"Average to good Thai food, but terrible delivery.",1726473:0,"['positive', 'negative']"
682,I've waited over one hour for food.,1726473:1,['negative']
683,They were very abrupt with me when I called and actually claimed the food was late because they were out of rice.,1726473:2,['negative']
684,A Thai restaurant out of rice during dinner?,1726473:3,['negative']
685,"The food arrived 20 minutes after I called, cold and soggy.",1726473:4,"['negative', 'negative']"
686,This is a wonderful place on all stand points especially value ofr money.,1727363:1,"['positive', 'positive']"
687,An excellent service,1727363:2,['positive']
688,We were greeted promptly by the waiter who was very nice and cordial.,1728733:1,['positive']
689,She was very helpful in suggesting us drinks and helped us in ordering a lot of good dishes since we knew nothing about Indian food.,1728733:2,"['positive', 'positive']"
690,The food looked very appetizing and delicious since it came on a variety of fancy plates.,1728733:4,['positive']
691,We ended our great experience by having Gulab Jamun (dessert) recommended by the waiter.,1728733:5,['positive']
692,I thanked my friend who recommended me this restaurant and will certainly recommend it to others.,1728733:6,['positive']
693,"Service here was great, food was fantastic.",1730014:1,"['positive', 'positive']"
694,"Guacamole+shrimp appetizer was really great, we both had the filet, very good, didn't much like the frites that came with, but the filet was so good, neither of us cared.",1730014:2,"['positive', 'positive', 'negative']"
695,Will absolutely visit again.,1730014:3,['positive']
696,You cannot go wrong with this place.,1730127:0,['positive']
697,"The food is outstanding and the service is quick, friendly and very professional.",1730127:1,"['positive', 'positive']"
698,"Always a nice crowd, but never loud.",1730127:2,"['positive', 'positive']"
699,Go here.,1730127:3,['positive']
700,Good for dates or with friends.,1730127:4,['positive']
701,I am reluctant to write because I would not want my jem of a pizza place to become overcrowded.,1730447:0,['positive']
702,"However, it is jus too good to not praise it.",1730447:1,['positive']
703,"By far, the best pizza in Manhattan.",1730447:2,['positive']
704,"The crust is thin, the ingredients are fresh and the staff is friendly.",1730447:3,"['positive', 'positive', 'positive']"
705,The menu has so many fish items and oysters.,1746113:1,['positive']
706,"The fish was really,really fresh.",1746113:3,['positive']
707,We all agreed that mare is one of the best seafood restaurants in New York.,1746113:5,['positive']
708,I stumbled upon this great pizzeria as I explored my new neighborhood.,1748813:0,['positive']
709,All of the pizzas are terrific and the price is even better!,1748813:1,"['positive', 'positive']"
710,I highly recommend the Sophia pizza.,1748813:2,['positive']
711,It's to die for!,1748813:3,['positive']
712,The food was mediocre at best but it was the horrible service that made me vow never to go back.,1748839:0,"['negative', 'negative']"
713,"Immediately after we paid, the waiter took the money and said, okay, you guys are outta here.",1748839:1,['negative']
714,So rushing us out was absolutely unnecessary!,1748839:6,['negative']
715,"For the people who want great food plus great service, Roxy is a place to AVOID!",1748839:7,"['negative', 'negative']"
716,"The first time the sushi was outstanding, the second time it was a little bland.",378848:1,"['positive', 'negative']"
717,I'm sure I'll return for a final judgement tho.,378848:2,['neutral']
718,"The blond wood decor is very soothing, the premium sake is excellent and the service is great.",378848:3,"['positive', 'positive', 'positive']"
719,Mizu is the Japenese find in Grammercy.,397331:0,['positive']
720,"While their kitchen food is delicious, their Sushi is out of this world.",397331:1,"['positive', 'positive']"
721,Mizu is home to creative and unique rolls not to found anywhere else.,397331:2,['positive']
722,"Not only is the cuisine the best around, the service has always been attentive and charming.",397331:3,"['positive', 'positive']"
723,Warning: You may find it difficult to dine at other Japanese restaurants after a visit to Mizu!,397331:4,['positive']
724,"Thalia is a beautiful restaurant with beautiful people serving you, but the food doesn't quite match up.",404464:0,"['positive', 'negative', 'positive']"
725,I ordered the smoked salmon and roe appetizer and it was off flavor.,404464:1,['negative']
726,"The entree was bland and small, dessert was not inspired.",404464:2,"['negative', 'negative', 'negative']"
727,I expected quite a bit more from such an expensive menu.,404464:3,"['negative', 'negative']"
728,"The view is spectacular, and the food is great.",426805:0,"['positive', 'positive']"
729,Wonderful strawberry daiquiries as well!,426805:1,['positive']
730,Definitely worth the trip to Battery Park City!,426805:2,['positive']
731,One of my favorite places in Manhattan.,426805:3,['positive']
732,Authentic Taiwanese food that's cheap... what more could you ask for?,426930:0,"['positive', 'positive']"
733,(Besides that there should be more restaurants like it around the city).,426930:1,['positive']
734,The cold appetizer dishes taste like the way I remember them to taste when I was growing up in Taiwan.,426930:2,['positive']
735,delicious simple food in nice outdoor atmosphere.,430342:0,"['positive', 'positive', 'positive']"
736,"Kind, attentive wait staff.",430342:1,['positive']
737,I really like both the scallops and the mahi mahi (on saffron risotto-yum!).,430342:2,"['positive', 'positive']"
738,My friend devoured her chicken and mashed potatos.,430342:3,['positive']
739,Delicious crab cakes too.,430342:4,['positive']
740,"Even if the food wasn't this good, the garden is a great place to sit outside and relax.",430342:5,"['positive', 'positive']"
741,Great neighborhood joint.,430342:6,['positive']
742,This is a nice pizza place with good selection of thin crust pizza including the Basil slice.,433878:0,"['positive', 'positive', 'positive', 'positive']"
743,"Their calzones are horrific, bad, vomit-inducing, YUCK.",433878:1,['negative']
744,They smell like they stuff them with old canned vegetables like the spinach mushroom calzone.,433878:2,['negative']
745,The counter service is bad.,433878:3,['negative']
746,They charge different prices all the time.,433878:4,['negative']
747,"They're rude at times, and not very friendly.",433878:5,['negative']
748,NO PIZZA 33 for me!,433878:6,['negative']
749,"Anybody who likes this place must be from a different planet, where greasy, dry and tasteless are complimentary.",436868:0,['negative']
750,"The dosas are skimpy, unattractive and drip with grease, and personally I'd drink popcorn topping before I'd eat another one of these.",436868:1,"['negative', 'negative']"
751,"The sandwiches are dry, tasteless and way overpriced.",436868:2,"['negative', 'negative']"
752,"Calling the place Hampton Chutney Co. does warn you that these folks offer more style than substance, but in this unattractive room with unhelpful clerks there was a dearth of the former too.",436868:3,"['negative', 'negative', 'negative']"
753,"Seriously, this place kicks ass.",444818:0,['positive']
754,"The atmosphere is unheralded, the service impecible, and the food magnificant.",444818:1,"['positive', 'positive', 'positive']"
755,"Best Italian food I ever had (and being Italian, that means alot).",444818:2,['positive']
756,"It is nearly impossible to get a table, so if you ever have the chance to go here for dinner, DO NOT pass it up.",444818:3,['positive']
757,"This is such a lovely, peaceful place to eat outside.",445960:0,['positive']
758,The restaurant looks out over beautiful green lawns to the Hudson River and the Statue of Liberty.,445960:1,['positive']
759,"It is set far from the small street it's on, and there is no traffic noise.",445960:2,['positive']
760,"The food is good, especially their more basic dishes, and the drinks are delicious.",445960:3,"['positive', 'positive', 'positive']"
761,"This is a great place to take out-of-towners, and perfect for watching the sunset.",445960:4,['positive']
762,Great sushi experience.,447697:0,['positive']
763,Nice value.,447697:1,['positive']
764,Unique apppetizers.,447697:2,['positive']
765,Try sushimi cucumber roll.,447697:3,['positive']
766,"Good spreads, great beverage selections and bagels really tasty.",449802:0,"['positive', 'positive', 'positive']"
767,THE BIG COMPLAINT: NO TOASTING AVAILABLE.,449802:1,['negative']
768,Murray won't do it.,449802:3,['negative']
769,Won't or Can't is not in the service directory.,449802:4,['negative']
770,But who says Murray's is anything about service.,449802:5,['negative']
