,text,id,polarities
0,"Judging from previous posts this used to be a good place, but not any longer.",1004293:0,['negative']
1,"We, there were four of us, arrived at noon - the place was empty - and the staff acted like we were imposing on them and they were very rude.",1004293:1,['negative']
2,"They never brought us complimentary noodles, ignored repeated requests for sugar, and threw our dishes on the table.",1004293:2,['negative']
3,The food was lousy - too sweet or too salty and the portions tiny.,1004293:3,"['negative', 'negative']"
4,"After all that, they complained to me about the small tip.",1004293:4,['negative']
5,Avoid this place!,1004293:5,['negative']
6,"I have eaten at Saul, many times, the food is always consistently, outrageously good.",1014458:0,['positive']
7,Saul is the best restaurant on Smith Street and in Brooklyn.,1014458:1,['positive']
8,The duck confit is always amazing and the foie gras terrine with figs was out of this world.,1014458:2,"['positive', 'positive']"
9,The wine list is interesting and has many good values.,1014458:3,"['positive', 'positive']"
10,"For the price, you cannot eat this well in Manhattan.",1014458:4,"['positive', 'positive']"
11,I was very disappointed with this restaurant.,1016296:0,['negative']
12,Ive asked a cart attendant for a lotus leaf wrapped rice and she replied back rice and just walked away.,1016296:1,['negative']
13,I had to ask her three times before she finally came back with the dish Ive requested.,1016296:2,['negative']
14,"Food was okay, nothing great.",1016296:3,['neutral']
15,Chow fun was dry; pork shu mai was more than usually greasy and had to share a table with loud and rude family. ,1016296:4,"['negative', 'negative', 'negative']"
16,I/we will never go back to this place again.,1016296:5,['negative']
17,"Went on a 3 day oyster binge, with Fish bringing up the closing, and I am so glad this was the place it O trip ended, because it was so great!",1028246:0,['positive']
18,"Service was devine, oysters where a sensual as they come, and the price can't be beat!!!",1028246:1,"['positive', 'positive', 'positive']"
19,You can't go wrong here.,1028246:2,['positive']
20,Every time in New York I make it a point to visit Restaurant Saul on Smith Street.,1032695:0,['positive']
21,"Everything is always cooked to perfection, the service is excellent, the decor cool and understated.",1032695:1,"['positive', 'positive', 'positive']"
22,I had the duck breast special on my last visit and it was incredible.,1032695:2,['positive']
23,Can't wait wait for my next visit.,1032695:3,['positive']
24,And I hate to say this but I doubt I'll ever go back. ,1041457:1,['negative']
25,"The food is very average...the Thai fusion stuff is a bit too sweet, every thing they serve is too sweet here.",1041457:2,"['negative', 'negative', 'negative']"
26,The only thing I moderately enjoyed was their Grilled Chicken special with Edamame Puree.,1041457:3,['positive']
27,I had never had Edamame pureed before but I thought it was innovative and tasty (could've used a bit more salt).,1041457:4,"['positive', 'positive']"
28,"The decor is night tho...but they REALLY need to clean that vent in the ceiling...its quite un-appetizing, and kills your effort to make this place look sleek and modern.",1041457:6,"['negative', 'positive', 'negative']"
29,"Their sake list was extensive, but we were looking for Purple Haze, which wasn't listed but made for us upon request!",1053543:2,"['positive', 'positive']"
30,"The spicy tuna roll was unusually good and the rock shrimp tempura was awesome, great appetizer to share!",1053543:3,"['positive', 'positive']"
31,We went around 9:30 on a Friday and it had died down a bit by then so the service was great!,1053543:4,['positive']
32,we love th pink pony.,1055910:0,['positive']
33,THe perfect spot.,1055910:1,['positive']
34,Food-awesome.,1055910:2,['positive']
35,Service- friendly and attentive.,1055910:3,['positive']
36,Ambiance- relaxed and stylish.,1055910:4,['positive']
37,"Don't judge this place prima facie, you have to try it to believe it, a home away from home for the literate heart.",1055910:5,['positive']
38,the food is decent.,1058221:2,['neutral']
39,"however, it's the service that leaves a bad taste in my mouth.",1058221:3,['negative']
40,"i happen to have a policy that goes along with a little bit of self-respect, which includes not letting a waiter intimidate me, i.e. make me feel bad asking for trivialities like water, or the check.",1058221:4,['negative']
41,"i know, you were too busy showing off your vintage tee shirt and looking bored, but my agenda is i'm here to eat and enjoy the company of friends, seeking a pleasant experience.",1058221:5,['negative']
42,"well, i didn't find it there, and trust, i have told everyone i can think of about my experience. ",1058221:6,['negative']
43,the last time i walked by it looked pretty empty. hmmm.,1058221:7,['negative']
44,This place has got to be the best japanese restaurant in the new york area.,1062641:0,['positive']
45,I had a great experience.,1062641:1,['positive']
46,Food is great.,1062641:2,['positive']
47,Service is top notch.,1062641:3,['positive']
48,I have been going back again and again.,1062641:4,['positive']
49,"I tend to judge a sushi restaurant by its sea urchin, which was heavenly at sushi rose.",1064477:0,['positive']
50,"It melted in my little mouth and the perfect consistency-not too fishy, creamy, and slightly buttery.",1064477:1,['positive']
51,The sushi seemed pretty fresh and was adequately proportioned.,1064477:2,"['positive', 'positive']"
52,The rice to fish ration was also good--they didn't try to overpack the rice.,1064477:3,['positive']
53,We took advanatage of the half price sushi deal on saturday so it was well worth it.,1064477:4,"['positive', 'positive']"
54,Surprisingly nothing could be further from the truth.,1074868:2,['positive']
55,"In the evening, this place attracted a well dressed, with it, NY crowd.",1074868:3,['positive']
56,The food was well prepared and the service impecable.,1074868:4,"['positive', 'positive']"
57,I'm going back.,1074868:5,['positive']
58,Quite simply it's like stepping out of Manhattan and into a haven of tranquility.,1084394:1,['positive']
59,The Prix Fixe menu is worth every penny and you get more than enough (both in quantity AND quality).,1084394:3,"['positive', 'positive', 'positive']"
60,I will be going back and heartily recommend it!,1084394:4,['positive']
61,"It is terrific, as is the value.",1086415:1,"['positive', 'positive']"
62,"$6 and there is much tasty food, all of it fresh and continually refilled.",1086415:2,"['positive', 'positive', 'positive']"
63,"I am not a vegetarian but, almost all the dishes were great.",1086415:3,['positive']
64,Go hungry and enjoy.,1086415:5,['positive']
65,"The food here is rather good, but only if you like to wait for it.",1086478:0,"['positive', 'negative']"
66,"I like the somosas, chai, and the chole, but the dhosas and dhal were kinda dissapointing.",1086478:1,"['positive', 'positive', 'positive', 'negative', 'negative']"
67,"The service varys from day to day- sometimes they're very nice, and sometimes not.",1086478:2,['negative']
68,"The kitchen however, is almost always slow.",1086478:3,['negative']
69,"Also, specify if you like your food spicy- its rather bland if you don't.",1086478:4,['negative']
70,"The ambience is pretty and nice for conversation, so a casual lunch here would probably be best.",1086478:5,"['positive', 'positive']"
71,If you've ever been along the river in Weehawken you have an idea of the top of view the chart house has to offer.,1090587:1,['positive']
72,Add to that great service and great food at a reasonable price and you have yourself the beginning of a great evening.,1090587:2,"['positive', 'positive', 'positive']"
73,The lava cake dessert was incredible and I recommend it.,1090587:3,['positive']
74,"Once you step into Cosette, you're miraculously in a small, off-the-beaten path Parisian bistro.",1102681:0,['positive']
75,"This tiny restaurant is as cozy as it gets, with that certain Parisian flair.",1102681:1,['positive']
76,"The food was average to above-average; the French Onion soup filling yet not overly impressive, and the desserts not brilliant in any way.",1102681:2,"['positive', 'negative', 'positive', 'negative']"
77,"However, go for the ambience, and consider the food just a companion for a trip across the world!",1102681:3,"['positive', 'neutral']"
78,IT WAS HORRIBLE.,1118167:1,['negative']
79,The pizza was delivered cold and the cheese wasn't even fully melted!,1118167:2,"['negative', 'negative']"
80,It looked like shredded cheese partly done - still in strips.,1118167:3,['negative']
81,This has got to be one of the most overrated restaurants in Brooklyn.,1119578:0,['negative']
82,The pizza is overpriced and soggy.,1119578:1,"['negative', 'negative']"
83,"Yes, they use fancy ingredients, but even fancy ingredients don't make for good pizza unless someone knows how to get the crust right.",1119578:2,"['positive', 'negative', 'negative']"
84,"A big disappointment, all around.",1119578:3,['negative']
85,I think I've had some the best meals of my life at minnow.,1123262:0,['positive']
86,"The seafood is amazing, there's a good wine list, and the ever-changing menu always offers some great surprises.",1123262:1,"['positive', 'positive', 'positive']"
87,The combination of super-fresh ingredients in the dishes are unusual but really delicious.,1123262:2,['positive']
88,Worth the trip from Manhattan.,1123262:3,['positive']
89,Best Pastrami I ever had and great portion without being ridiculous.,1125006:1,"['positive', 'positive']"
90,My wife had the fried shrimp which are huge and loved it.,1125006:3,"['positive', 'positive']"
91,"As a Japanese native, I've lived in the Tristate area for over 8 years, but I was just so amazed at this place.",1125284:0,['positive']
92,This place is the most Japanese it can ever get.,1125284:1,['positive']
93,"The signs, the specials menus, food, and even all the waitstaff are ALL TOTALLY Japanese.",1125284:2,"['positive', 'positive', 'positive', 'positive']"
94,This place is worth an one-hour drive.,1125284:3,['positive']
95,"I am so coming back here again, as much as I can.",1125284:4,['positive']
96,"Leon is an East Village gem: casual but hip, with well prepared basic French bistro fare, good specials, a warm and lively atmosphere.",1126814:0,"['positive', 'positive', 'positive', 'positive', 'positive']"
97,"My wife and I always enjoy the young, not always well trained but nevertheless friendly, staff, all of whom have a story.",1126814:1,['positive']
98,Decent wine at reasonable prices.,1126814:3,"['neutral', 'positive']"
99,Have been dozens of times and never failed to enjoy the experience.,1126814:4,['positive']
100,"Our teenage kids love it, too.",1126814:5,['positive']
101,"Everytime I decide to try another place on the UES, I get angry that I didn't just go to Zucchero Pomodori.",1126886:0,['positive']
102,This is by far my favorite place in the neighborhood.,1126886:1,['positive']
103,"The service is excellent, the decor is great, and the food is delicious and comes in large portions.",1126886:2,"['positive', 'positive', 'positive', 'positive']"
104,I'm partial to the Gnocchi.,1126886:4,['positive']
105,This place is incredibly tiny.,1131595:0,['negative']
106,They refuse to seat parties of 3 or more on weekends.,1131595:1,['negative']
107,The hostess is rude to the point of being offensive.,1131595:2,['negative']
108,The food was bland oily.,1131595:3,['negative']
109,I just don't understand all the hype...,1131595:4,['negative']
110,"We have been to this place many times, and always have great food, wine, and service.",1138996:1,"['positive', 'positive', 'positive']"
111,"We were worried we would have trouble getting in, but somehow managed to have a short wait.",1138996:2,['positive']
112,As always we had a great glass of wine while we waited.,1138996:3,['positive']
113,"When we sat, we got great and fast service.",1138996:4,['positive']
114,The people that work there are always so friendly you forget you are in New York sometimes.,1138996:5,['positive']
115,Make sure you try this place as often as you can.,1138996:6,['positive']
116,This is a fun restaurant to go to.,1145510:0,['positive']
117,The pizza is yummy and I like the atmoshpere.,1145510:1,"['positive', 'positive']"
118,But the pizza is way to expensive.,1145510:2,['negative']
119,"A large is $20, and toppings are about $3 each.",1145510:3,"['negative', 'negative']"
120,I went there for lunch and it was not as good as I expected from the reviews I read.,1147082:0,['negative']
121,Sauce was watery and the food didn't have much flavor.,1147082:1,"['negative', 'negative']"
122,I don't think I would go again.,1147082:3,['negative']
123,This place is great.,1147211:0,['positive']
124,I had a huge group for my birthday and we were well taken care of.,1147211:1,['positive']
125,The waitress was very patient with us and the food is phenomenal!,1147211:2,"['positive', 'positive']"
126,"Service was prompt, friendly and great.",1147211:3,['positive']
127,Slightly on the pricey side but worth it!,1147211:4,"['negative', 'positive']"
128,Great pizza and fantastic service.,1153034:0,"['positive', 'positive']"
129,"There was a small wait, but shorter than I expected.",1153034:1,['positive']
130,Located at the end of a magnificent block.,1153034:2,['positive']
131,Very cozy and warm inside.....,1153034:3,['positive']
132,I will be back!,1153034:4,['positive']
133,This is the best sushi in new york city - hands down.,1154550:0,['positive']
134,The place is small and cramped but the food is fantastic.,1154550:1,"['negative', 'positive']"
135,Get the tuna of gari.,1154550:2,['positive']
136,"Planet Thailand has always been a hit with me , I go there usually for the sushi, which is great , the thai food is excellent too .",1162037:0,"['positive', 'positive', 'positive']"
137,"With the great variety on the menu , I eat here often and never get bored .",1162037:1,['positive']
138,"The atmosphere isn't the greatest , but I suppose that's how they keep the prices down .",1162037:2,"['neutral', 'positive']"
139,It's all about the food !!,1162037:3,['positive']
140,first it took us a long time to find the place.,1167434:1,['negative']
141,"but when we looked at the menu, there weren't a lot of choices, most of them were dumplings in the appetizer section.",1167434:3,['negative']
142,"those rolls were big, but not good and sashimi wasn't fresh.",1167434:5,"['neutral', 'negative', 'negative']"
143,"they were dry and disgusting, i didn't even finish my first piece.",1167434:6,['negative']
144,Hurley's is like Cheers where everyone knows your name and they are ACTUALLY glad you came.,1175958:0,['positive']
145,"Try the crunchy tuna, it is to die for.",1175958:1,['positive']
146,"Try everything for that matter, it is all good.",1175958:2,['positive']
147,I have been going there since it opened and I can't get enough.,1175958:3,['positive']
148,First went here to enjoy their garden terrace.,1189674:0,['positive']
149,"The food was amazing, and the service was prompt and helpful, but not over-bearing or rushed.",1189674:1,"['positive', 'positive']"
150,"The Steak Tartare is a great bet, they fix it for you at the table.",1189674:2,['positive']
151,"Admittedly some nights inside the restaurant were rather warm, but the open kitchen is part of the charm.",1189674:3,"['positive', 'negative']"
152,"Great wine selection, Gigondas is worth the price, and the house champagne is a great value.",1189674:4,"['positive', 'positive', 'positive']"
153,"It may be a bit packed on weekends, but the vibe is good and it is the best French food you will find in the area.",1189674:5,"['neutral', 'positive', 'positive']"
154,"Have recommended the place to friends, always gets good response.",1189674:6,['positive']
155,"Pizza - the only pizza in NYC that should not have additional toppings - the crust tastes like the best, freshly baked bread!",1199292:0,"['positive', 'positive']"
156,I take all my NYC guests to VT's.,1199292:3,['positive']
157,"Not sure where the previous reviewer, lonk, dined, but Saul is in a great neighborhood and has great food!",1199480:0,"['positive', 'positive']"
158,I've been there three times and have always had wonderful experiences.,1199480:1,['positive']
159,I'd highly recommend it for a special occasion -- it provides and intimate setting and nice service.,1199480:2,"['positive', 'positive', 'positive']"
160,I'm not sure where the other reviewers ate but it seems as if we visited two different restaurants because my friends and I all enjoy Mizu very much... and we're repeat customers.,1205520:0,['positive']
161,Even after they overcharged me the last time I was there.,1205520:1,['negative']
162,Make sure you have the Spicy Scallop roll.. .,1205520:2,['positive']
163,it's delicious!,1205520:3,['positive']
164,"Moules were excellent, lobster ravioli was VERY salty!",1212346:0,"['positive', 'negative']"
165,"Took my mom for Mother's Day, and the maitre d' was pretty rude.",1212346:1,['negative']
166,"Told us to sit anywhere, and when we sat he said the table was reserved.",1212346:2,['negative']
167,Stepped on my foot on the SECOND time he reached over me to adjust lighting.,1212346:3,['negative']
168,Tiny dessert was $8.00...just plain overpriced for what it is.,1212346:4,"['negative', 'negative']"
169,The drinks are always welll made and wine selection is fairly priced.,1221938:0,"['positive', 'positive']"
170,Try their chef's specials-- they are to die for.,1221938:1,['positive']
171,"Service is not exactly five star, but thats not really a big deal.",1221938:2,['neutral']
172,Downstairs lounge is always a good attraction,1221938:3,['positive']
173,"Raga's is a romantic, cozy restaurant.",1225162:0,['positive']
174,The exotic food is beautifully presented and is a delight in delicious combinations.,1225162:1,"['positive', 'positive']"
175,It is also extremely well priced.,1225162:2,['positive']
176,The staff is incredibly helpful and attentive.,1225162:3,['positive']
177,The bar is very well stocked with interesting beers and well priced wines.,1225162:4,"['positive', 'positive', 'positive']"
178,This is one of my favorite restaurants and it is not to be missed.,1225162:5,['positive']
179,Your friends will thank you for introducing them to this gem!,1225162:6,['positive']
180,"When we stumbled on Leon, we thought that we had found quite the gem BUT, we were certainly wrong.",1227999:0,['negative']
181,"The waitress moved our table practically into the bathroom and when we asked to cancel our dinner orders because we did not want to eat sitting on the toilet, we were told no...",1227999:1,['negative']
182,"Then, to top things off, she dropped used silverware on my boyfriend's jacket and did not stop to apologize or clean the mess that was left on clothes. ",1227999:2,['negative']
183,Such a disappointment...,1227999:3,['negative']
184,"Rude service, medicore food...there are tons of restaurants in NY...stay away from this one",1227999:4,"['negative', 'neutral', 'negative']"
185,I had a grat time at Jekyll and Hyde!,1230993:0,['positive']
186,I loved everythig about it-especially the shows and actors.,1230993:1,"['positive', 'positive', 'positive']"
187,Our server was very helpful and friendly.,1230993:2,['positive']
188,I am bringing my whole family back next time.,1230993:3,['positive']
189,The food was good too.,1230993:4,['positive']
190,The tuna and wasabe potatoes are excellent.,1232468:0,"['positive', 'positive']"
191,The outdoor atmosphere of sitting on the sidewalk watching the world go by 50 feet away on 6th avenue on a cool evening was wonderful.,1232468:1,['positive']
192,"Inside is a little cramped, but to be expected.",1232468:2,['neutral']
193,Service was prompt and courteous.,1232468:3,['positive']
194,This was a repeat visit and we'll definitely be back again.,1232468:4,['positive']
195,"Great service, great food.",1241906:0,"['positive', 'positive']"
196,Prices are in line.,1241906:1,['neutral']
197,But too far east!,1241906:3,['negative']
198,"The pizza is delicious - they use fresh mozzarella instead of the cheap, frozen, shredded cheese common to most pizzaria's.",1253117:1,"['positive', 'positive']"
199,"Two complaints- their appetizer selection stinks, it would be nice to get some mozzarella sticks on the menu.",1253117:2,['negative']
200,"Also, because it is so thin, it gets cold very quickly and its not that filling.",1253117:3,"['negative', 'negative']"
201,Wait staff is blantently unappreciative of your business but its the best pie on the UWS!,1253117:5,"['negative', 'positive']"
202,By far the best salad I have had in a fast food restaurant.,1256373:0,['positive']
203,fine dining restaurant quality.,1256373:1,['positive']
204,Over 100 different choices to create your own.,1256373:2,['positive']
205,A must try!,1256373:3,['positive']
206,"On a recent Sunday afternoon, a friend and I accidently found this great restaurant on our way to see the pulitzer prize winning play DOUBT.",1264954:0,['positive']
207,"This was the perfect quiet, relaxing, and delicious accompaniment to our afternoon of theater.",1264954:1,"['positive', 'positive']"
208,"The chicken pot pie is excpetiona, the cheeseburger huge and delictable, and the service professional wan warm.",1264954:2,"['positive', 'positive', 'positive', 'positive']"
209,"With so many poor experiences to be had in the theater district, is truly an excellent find!",1264954:3,['positive']
210,We will return many times for this oasis in mid-town.,1264954:4,['positive']
211,The staff is no nonsense.,1269216:1,['positive']
212,The food options rule.,1269216:2,['positive']
213,When I lived upstate for a while I would buy freeze the bagels and they would still be better than any else.,1269216:3,['positive']
214,Worth visiting the 1st Ave spot because it is the original store.,1269216:4,['positive']
215,"He served me an Uni Hand roll, which I never had before, and let me tell you...IT WAS HEAVEN!",1275154:4,['positive']
216,The sake menu should not be overlooked!,1275154:6,['positive']
217,"All in all, this midtown gem instantly became one of my favorite sushi restaurants in the city.",1275154:7,['positive']
218,Try the lobster teriyaki and the rose special roll.,1275154:8,"['positive', 'positive']"
219,"Service was very good - prompt, attentive and non-intrusive.",1280166:1,['positive']
220,"Food was very good as well, considering that we tried the budget selection (though I wish the pork belly that I ordered was roasted a bit longer, so that fat was more of a melt-in-your-mouth experience).",1280166:2,"['positive', 'negative']"
221,Wine list selection is good and wine-by-the-glass was generously filled to the top.,1280166:3,"['positive', 'positive']"
222,Traditional French decour was pleasant though the hall was rather noisy - the restaurant was full and we had to raise our voices to be able to maintain a conversation.,1280166:4,"['positive', 'negative']"
223,"I've been to at Cafe Spice probably 5-8 times, it is probably still the best Indian restaurant around Union Square.",1280179:0,['positive']
224,"To sum it up: Service varies from good to mediorce, depending on which waiter you get; generally it is just average Ok. ",1280179:1,['neutral']
225,"Seating is always prompt, though the restaurant does fill up in the evening.",1280179:2,['positive']
226,"Food is usually very good, though ocasionally I wondered about freshmess of raw vegatables in side orders.",1280179:3,"['positive', 'negative']"
227,"As many other reviewers noticed, your order is often slow to arrive - this is particularly true in the evening but is not a problem during lunch time.",1280179:4,['neutral']
228,"The decor is vibrant and eye-pleasing with several semi-private boths on the right side of the dining hall, which are great for a date.",1280179:5,"['positive', 'positive']"
229,I have NEVER been disappointed in the Red Eye.,1286916:0,['positive']
230,"The first time I went, and was completely taken by the live jazz band and atmosphere, I ordered the Lobster Cobb Salad.",1286916:1,"['positive', 'positive']"
231,It's simply the best meal in NYC.,1286916:3,['positive']
232,You cannot go wrong at the Red Eye Grill.,1286916:4,['positive']
233,"If we were to move from the upper east side, we would genuinely miss this restaurant.",1287538:0,['positive']
234,The restaurant is cute but not upscale.,1287538:2,['neutral']
235,The food is a diamond in rough -- the food is delicious and homemade with the perfect balance of herbs and tomatoes.,1287538:3,"['positive', 'positive']"
236,I would highly recommend it.,1287538:4,['positive']
237,It's one of our favorite places to eat in NY.,1287538:5,['positive']
238,We had a great time at the Jekyll and hyde Pub last night.,1289424:0,['positive']
239,After really enjoying ourselves at the bar we sat down at a table and had dinner.,1289424:2,['positive']
240,The server was really cool and served us our food and drinks with a smile.,1289424:3,['positive']
241,The place's decor and hidden bathrooms made for a good laugh.,1289424:4,"['positive', 'positive']"
242,I highly recommend visiting this restaurant and having dinner and drinks!,1289424:5,['positive']
243,"If you are the type of person who likes being scared and entertained, this is a great place to go and eat.",1293334:0,['positive']
244,"My husband and I thougt it would be great to go to the Jekyll and Hyde Pub for our anniversary, and to our surprise it was fantastic.",1293334:1,['positive']
245,"The have over 100 different beers to offer thier guest so that made my husband very happy and the food was delicious, if I must recommend a dish it must be the pumkin tortelini.",1293334:2,"['positive', 'positive', 'positive']"
246,The entertainment was great they have shows that go on through out the dinner.,1293334:3,['positive']
